gap_id,kind,subject,sought,searched,found_instead,blocks,would_close_it,status,last_checked
gap-01-arm-marketcap-divergence,contradiction,Arm,a single defensible market capitalisation for Arm,"companiesmarketcap.com, retrieved 2026-07-13; stockanalysis.com, retrieved 2026-07-13","the trackers disagree by roughly 20 percent, $320B to $383B. One figure was picked and the range noted in the row, but the row still presents a point value at source_tier 1.",any comparison that leans on Arm's market cap carries an unstated 20 percent band,"a filed share count plus a dated closing price, the method used for 04's rows, which reduces the tracker to price only",open,2026-07-20
gap-01-skhynix-marketcap-divergence,contradiction,SK hynix,a single defensible market capitalisation for SK hynix,"SK hynix SEC Form F-1, filed ahead of its Jul 2026 Nasdaq listing (the source of every other figure in the row); the market-cap trackers cited in the row note, retrieved 2026-07-13","the F-1 gives audited figures but no post-listing market cap; the trackers span $877B to $1.07T, a 22 percent spread, most likely a stale pre-listing baseline colliding with post-listing prices days after the Nasdaq debut.",SK hynix is a chokepoint on both 01 and 04; a fifth of its market cap is unresolved,"the post-listing share count from SK hynix's own F-1 or 20-F, multiplied by a dated close",open,2026-07-20
gap-01-samsung-capex-two-figures,contradiction,Samsung,which capex figure is Samsung's,Samsung FY2025 audited cash flow statement (KRW47.52tn purchases of PP&E); press coverage citing KRW52.7tn facility investment,two different public numbers for the same year. The audited cash flow figure was used and both were noted.,cross-company capex comparison on this map mixes an audited cash-flow basis with whatever basis other rows used,"Samsung defining facility investment in a filed document, or a segment note reconciling the two",open,2026-07-20
gap-01-arm-licensing-edges-stale,stale-evidence,Arm -> Nvidia; Arm -> Apple; Arm -> Samsung,current evidence for Arm's architecture licensing relationships,"the cited sources on those three edges, dated 2021-01-01 and 2023-01-01","the edges are real and sourced, but their evidence is 3 to 5 years older than anything else on this map, and Arm has since IPO'd and restructured its licensing terms.",three of this map's licensing edges rest on the oldest evidence it carries,"Arm's own 20-F or annual report naming these licensees, which would also raise the tier",open,2026-07-20
gap-01-taiyo-yuden-miscited,contradiction,Taiyo Yuden,the document behind Taiyo Yuden's FY2026 figures,"the row's own cited PDF at taiyo-hd.co.jp, refetched 2026-07-21 (58,296 chars); the four figures in the row's note searched against it","THE CITED DOCUMENT IS A DIFFERENT COMPANY. It states 'Company name: TAIYO HOLDINGS CO., LTD.' and 'Stock code: 4626'. Taiyo Yuden is 6976, which is the ticker on this row. Taiyo Holdings reports net sales of JPY137,851M for the year ended 2026-03-31; this row claims JPY355,341M, and NONE of its four figures (355,341 / 14,806 / 14,474 / 41,063) appear anywhere in the cited PDF.","a tier-1 row in the flagship map cites a document that does not support it. The figures are plausibly genuine Taiyo Yuden numbers sourced elsewhere, but as cited they are unverifiable, and check_identity.py cannot catch this because it only guards EDGAR CIKs","Taiyo Yuden Co Ltd's own FY2026 consolidated results from its IR site (ticker 6976), which would either confirm these four figures or replace them",open,2026-07-21
gap-01-tdk-source-blocked,unreachable,TDK,the document behind TDK's costed figures,"the row's cited PDF at tdk.com, refetched 2026-07-21 under both the project user agent and a browser user agent","HTTP 403 Forbidden to both. The host refuses automated clients outright, so the citation cannot be machine-verified from here.","nothing about the figures, but the citation cannot be checked by tooling and must be taken on trust","the same results filed somewhere machine-readable, or a manual confirmation recorded in the row note with the date it was read by eye",open,2026-07-21
gap-01-lenovo-source-blocked,unreachable,Lenovo,the document behind Lenovo's costed figures,"the row's cited press-release URL at news.lenovo.com, refetched 2026-07-21 under both user agents","HTTP 403 Forbidden to both. Note the URL is also a press-room INDEX path rather than a single release, so even if reachable it may not be the document itself.","same as TDK: the figures may be fine, the citation cannot be verified","Lenovo's HKEX filing for the same period, which is a durable machine-readable source unlike a press room",open,2026-07-21
