company,ticker,exchange,hq_country,roles,primary_segment,revenue_usd_b,net_income_usd_b,market_cap_usd_b,rd_spend_usd_b,capex_usd_b,fiscal_year,filing_source,last_updated,chokepoint,notes,lens,source_tier
Nvidia,NVDA,NASDAQ,United States,accelerator-designer;networking,"AI GPUs, NVLink/InfiniBand and CUDA software stack",215.94,120.07,5109,18.50,6.04,FY2026 (ended 2026-01-25),https://www.sec.gov/Archives/edgar/data/1045810/000104581026000019/q4fy26pr.htm,2026-07-13,yes,"Figures reused from 01-semiconductor, same filing, not re-derived. Carried from that row: Market cap ~US$5.11T as of 2026-07-12 (companiesmarketcap.com). USD reporter, no FX conversion needed. Dominant AI accelerator designer; CUDA software lock-in makes switching costly even where rival silicon exists; shared node with the semiconductor map.",accounting,1
AMD,AMD,NASDAQ,United States,accelerator-designer,Instinct GPU accelerators,34.64,4.34,909.69,8.09,0.97,FY2025 (ended 2025-12-27),https://www.sec.gov/Archives/edgar/data/2488/000000248826000018/0000002488-26-000018-index.htm,2026-07-14,no,"Figures reused from 01-semiconductor, same filing, not re-derived. Carried from that row: Semiconductor company; figures from FY2025 10-K (filed 2026-02). Market cap ~909.69B mid-July 2026 from stockanalysis.com (secondary; range 882-910B). Main credible alternative to Nvidia accelerators but single-digit-to-low-teens datacenter GPU share.",accounting,1
Intel,INTC,NASDAQ,United States,accelerator-designer;foundry,Gaudi AI accelerators; also a foundry,52.85,-0.27,518,13.77,14.65,FY2025 (ended 2025-12-27),https://www.sec.gov/Archives/edgar/data/50863/000005086326000009/q425earningsrelease.htm,2026-07-13,no,"Figures reused from 01-semiconductor, same filing, not re-derived. Carried from that row: IDM pivoting to contract foundry. Net income figure is a small net loss. Capex is gross additions to property, plant and equipment before government incentives/partner contributions (net capex was lower). Market cap ~US$518B as of 2026-07-13 (stockanalysis.com); other trackers show $460-566B this month, reflecting high volatility. USD reporter, no FX conversion needed. Gaudi/Falcon Shores line has struggled for share; included mainly for foundry overlap with semiconductor map.",accounting,1
Broadcom,AVGO,NASDAQ,United States,accelerator-designer;networking,"Custom AI ASIC co-design (Google TPU, Meta MTIA) and Tomahawk/Jericho switch silicon",63.89,23.13,1902.89,10.98,0.62,FY2025 (ended 2025-11-02),https://www.sec.gov/Archives/edgar/data/1730168/000173016825000121/0001730168-25-000121-index.htm,2026-07-14,no,"Figures reused from 01-semiconductor, same filing, not re-derived. Carried from that row: Semiconductor company; figures from FY2025 10-K. Net income taken from XBRL ProfitLoss tag (Broadcom did not populate NetIncomeLoss annually in this filing; NCI is negligible so it equals net income). Market cap ~1902.89B as of 2026-07-10 from stockanalysis.com (secondary source; sources ranged 1830-2000B that week). De facto sole partner for hyperscaler custom AI ASIC programs plus a merchant-silicon duopoly (with Marvell) in AI cluster switch chips; strong but a second source (Marvell) exists, so not a single point.",accounting,1
Marvell Technology,MRVL,NASDAQ,United States,accelerator-designer;networking,Custom AI silicon co-design and optical/electrical interconnect,8.19,2.67,170.44,2.08,0.35,FY2026 (ended 2026-01-31),https://www.sec.gov/Archives/edgar/data/1835632/000183563226000011/0001835632-26-000011-index.htm,2026-07-20,no,"Figures from the FY annual filing via SEC XBRL companyfacts (tools/xbrl_extract.py). Market cap = 874.3M shares from the filing cover page x $194.94 close on 2026-07-20 (Yahoo v8 chart endpoint, price only). Second source to Broadcom for custom AI ASIC and interconnect programs; growing but not yet a sole-source chokepoint.",accounting,1
Cerebras Systems,,private,United States,accelerator-designer,Wafer-scale AI training/inference chips,,,,,,,,2026-07-14,no,Niche wafer-scale architecture; filed and withdrew IPO plans; remains private as of mid-2026.,accounting,
Groq,,private,United States,accelerator-designer,LPU inference-only accelerators,,,,,,,,2026-07-14,no,Inference-specialist chip startup; small share of overall AI compute.,accounting,
SK hynix,000660.KS,Korea Exchange,South Korea,hbm-maker,High-bandwidth memory (HBM) for AI accelerators,63.76,28.19,1030,4.24,18.06,FY2025 (calendar year ended 2025-12-31),https://www.sec.gov/Archives/edgar/data/2120882/000119312526280172/d32785df1.htm,2026-07-13,yes,"Figures reused from 01-semiconductor, same filing, not re-derived. Carried from that row: Key HBM supplier for AI. Figures per SK hynix's SEC Form F-1 (filed ahead of its Jul 2026 Nasdaq listing), which converts KRW at W1,523.5 = US$1.00 (Mar 31 2026 Fed noon buying rate). Revenue KRW97,146,675mn, net income (profit for year) KRW42,948bn, R&D KRW6,466bn, capex KRW27,519bn. Market cap ~US$1.03T as of 2026-07-10, days after Nasdaq debut (source varies $877B-$1.07T across trackers). Leading HBM supplier to Nvidia; HBM output is capacity-constrained industry-wide; shared node with semiconductor map.",accounting,1
Samsung Electronics,005930.KS,Korea Exchange,South Korea,hbm-maker;foundry,"HBM memory, memory chips, foundry and devices",234.62,31.13,1108,26.51,33.42,FY2025 (calendar year ended 2025-12-31),https://images.samsung.com/is/content/samsung/assets/global/ir/docs/2025_con_quarter04_soi.pdf; https://images.samsung.com/is/content/samsung/assets/global/ir/docs/2025_4Q_conference_eng.pdf,2026-07-13,yes,"Figures reused from 01-semiconductor (as 'Samsung' there), same filing, not re-derived. Carried from that row: Vertically integrated across four roles. Net income = profit attributable to owners of parent (total incl. non-controlling interests was $31.79B). Converted from KRW at implied rate ~1,421.8 KRW/US$1 per Samsung's own USD-translated statements. Capex = cash purchase of PP&E per official cash flow statement (KRW47.52tn); a separate 'facility investment' figure of KRW52.7tn also circulates in press coverage. Market cap ~US$1.11T as of Jul 2026 (companiesmarketcap.com). One of only three companies that can make HBM at volume; also a foundry/packaging alternative; shared node with semiconductor map.",accounting,1
Micron Technology,MU,NASDAQ,United States,hbm-maker,HBM and DRAM memory for AI servers,37.38,8.54,1060.00,3.80,15.86,FY2025 (ended 2025-08-28),https://www.sec.gov/Archives/edgar/data/723125/000072312525000028/mu-20250828.htm,2026-07-14,yes,"Figures reused from 01-semiconductor (as 'Micron' there), same filing, not re-derived. Carried from that row: Memory (DRAM/NAND) semiconductor company. FY2025 10-K filed 2025-10-03. Capex is large relative to revenue due to HBM/DRAM fab investment. Market cap ~1060B as of 2026-07-13 from stockanalysis.com (secondary). Third member of the HBM oligopoly; HBM demand has outstripped supply through 2025-2026.",accounting,1
TSMC,TSM,NYSE / Taiwan Stock Exchange,Taiwan,foundry;packaging,Leading-edge fabrication and CoWoS advanced packaging for AI accelerators,122.42,55.21,2250,7.86,40.90,FY2025 (calendar year ended 2025-12-31),https://www.sec.gov/Archives/edgar/data/1046179/000162828026025362/tsm-20251231.htm,2026-07-13,yes,"Figures reused from 01-semiconductor, same filing, not re-derived. Carried from that row: Converted from NT$ at TSMC's own filed weighted-average rate of NT$31.11 = US$1.00 (per 20-F): revenue NT$3,809.05bn, net income NT$1,717.88bn, R&D NT$246,427mn, capex NT$1,272,411mn. Market cap ~US$2.25T as of Jul 2026 (companiesmarketcap.com). Sole leading-edge foundry for Nvidia/AMD/Google/Amazon AI silicon; CoWoS advanced-packaging capacity is a widely reported bottleneck on AI chip supply; shared node with semiconductor map.",accounting,1
Arista Networks,ANET,NYSE,United States,networking,High-speed Ethernet switches for AI back-end clusters,9.01,3.51,212.79,1.24,0.12,FY2025 (ended 2025-12-31),https://www.sec.gov/Archives/edgar/data/1596532/000159653226000013/0001596532-26-000013-index.htm,2026-07-20,no,"Figures from the FY annual filing via SEC XBRL companyfacts (tools/xbrl_extract.py). Market cap = 1256.5M shares from the filing cover page x $169.35 close on 2026-07-20 (Yahoo v8 chart endpoint, price only). Leading AI-cluster networking vendor but competes with Cisco, Juniper and white-box Broadcom-based switches.",accounting,1
Astera Labs,ALAB,NASDAQ,United States,networking,"PCIe/CXL retimers and connectivity chips linking GPUs, memory and networking",0.85,0.22,52.61,0.30,0.04,FY2025 (ended 2025-12-31),https://www.sec.gov/Archives/edgar/data/1736297/000173629726000010/0001736297-26-000010-index.htm,2026-07-20,no,"Figures from the FY annual filing via SEC XBRL companyfacts (tools/xbrl_extract.py). Market cap = 170.2M shares from the filing cover page x $309.09 close on 2026-07-20 (Yahoo v8 chart endpoint, price only). Fast-growing signal-integrity specialist inside AI servers; small but increasingly hard to route around as PCIe generations advance.",accounting,1
Super Micro Computer,SMCI,NASDAQ,United States,server-oem,AI server and rack-scale system integration,21.97,1.05,14.16,0.64,0.13,FY2025 (ended 2025-06-30),https://www.sec.gov/Archives/edgar/data/1375365/000137536525000027/0001375365-25-000027-index.htm,2026-07-20,no,"Figures from the FY annual filing via SEC XBRL companyfacts (tools/xbrl_extract.py). FY2026 ended 2026-06-30 but was not filed as of 2026-07-20, so FY2025 is the latest audited year. Market cap = 594.3M shares from the filing cover page x $23.83 close on 2026-07-20 (Yahoo v8 chart endpoint, price only). Fast-turnaround AI server builder; competes with Dell, HPE and ODMs.",accounting,1
Dell Technologies,DELL,NYSE,United States,server-oem,Enterprise AI servers and infrastructure,113.54,5.94,,3.14,2.63,FY2026 (ended 2026-01-30),https://www.sec.gov/Archives/edgar/data/1571996/000157199626000008/0001571996-26-000008-index.htm,2026-07-20,no,"Figures from the FY annual filing via SEC XBRL companyfacts (tools/xbrl_extract.py). Market cap left EMPTY: Dell does not tag a cover-page share count, and its dual class structure means a single-class count would be wrong anyway. Major AI server OEM for enterprise buyers; substitutable by other integrators.",accounting,1
Hewlett Packard Enterprise,HPE,NYSE,United States,server-oem,Enterprise AI servers and infrastructure,34.30,0.06,59.47,2.52,2.29,FY2025 (ended 2025-10-31),https://www.sec.gov/Archives/edgar/data/1645590/000164559025000130/0001645590-25-000130-index.htm,2026-07-20,no,"Figures from the FY annual filing via SEC XBRL companyfacts (tools/xbrl_extract.py). Net income of $0.06B is not a typo: it is the FY2025 attributable figure and it collapsed from $2.60B in FY2024. Market cap = 1334.5M shares from the filing cover page x $44.56 close on 2026-07-20 (Yahoo v8 chart endpoint, price only). Major AI server OEM; substitutable.",accounting,1
Foxconn (Hon Hai Precision),2317.TW,Taiwan Stock Exchange,Taiwan,server-oem;contract-manufacturer,Contract assembly of AI servers and GPU baseboards,,,,,,,,2026-07-14,no,"Largest assembler of Nvidia GB-series systems; alternatives exist in Quanta, Wistron, Wiwynn but Foxconn holds outsized share.",accounting,
Vertiv Holdings,VRT,NYSE,United States,datacenter-power;cooling,"Data center power, thermal management and liquid cooling systems",10.23,1.33,111.59,0.44,0.22,FY2025 (ended 2025-12-31),https://www.sec.gov/Archives/edgar/data/1674101/000167410126000008/0001674101-26-000008-index.htm,2026-07-20,no,"Figures from the FY annual filing via SEC XBRL companyfacts (tools/xbrl_extract.py). Market cap = 382.6M shares from the filing cover page x $291.67 close on 2026-07-20 (Yahoo v8 chart endpoint, price only). Leading supplier of liquid-cooling and power infrastructure for AI racks; the vendor set (with Schneider, Boyd, others) is capacity-strained but not sole-source, so treated as a theme, not a chokepoint.",accounting,1
Schneider Electric,SU.PA,Euronext Paris,France,datacenter-power;cooling,"Electrical distribution, UPS and cooling for data centers",,,,,,,,2026-07-14,no,Major data-center power/cooling vendor; competes directly with Vertiv and Eaton.,accounting,
Eaton Corporation,ETN,NYSE,Ireland,datacenter-power,"Power management, switchgear and large transformers",27.45,4.09,155.71,0.80,0.92,FY2025 (ended 2025-12-31),https://www.sec.gov/Archives/edgar/data/1551182/000155118226000007/0001551182-26-000007-index.htm,2026-07-20,no,"Figures from the FY annual filing via SEC XBRL companyfacts (tools/xbrl_extract.py). Net income is attributable to parent ($4.087B); the consolidated ProfitLoss line is $4.090B. Market cap = 387.9M shares from the filing cover page x $401.41 close on 2026-07-20 (Yahoo v8 chart endpoint, price only). Power management, switchgear and transformers with multi-year backlogs; the transformer/switchgear bottleneck is real but spread across several makers, so not a single irreplaceable node.",accounting,1
Siemens Energy,ENR.DE,Frankfurt Stock Exchange,Germany,datacenter-power,"Grid transformers, turbines and electrical grid equipment",,,,,,,,2026-07-14,yes,"One of a handful of manufacturers of large power transformers; global transformer lead times have stretched to years, gating grid interconnection for new data centers.",accounting,
Amazon (AWS),AMZN,NASDAQ,United States,hyperscaler,Cloud infrastructure (AWS) plus custom silicon (Trainium/Inferentia/Graviton),716.92,77.67,2639.00,,131.82,FY2025 (ended 2025-12-31),https://www.sec.gov/Archives/edgar/data/1018724/000101872426000004/amzn-20251231.htm,2026-07-14,no,"Figures reused from 01-semiconductor (as 'Amazon' there), same filing, not re-derived. Carried from that row: Whole-company figures; semiconductor is a small part (Graviton/Trainium/Inferentia). Figures from FY2025 10-K (filed 2026-02-06). R&D left blank: Amazon does not disclose a discrete R&D line; R&D is bundled into Technology and infrastructure (108.52B for FY2025, which also includes AWS server/datacenter costs), so a clean R&D figure is not reported. Capex is Purchases of property and equipment. Market cap ~2639B as of 2026-07-14 from stockanalysis.com (secondary). One of three hyperscalers; buyers can and do route workloads between AWS, Azure and Google Cloud, so cloud concentration is a theme (see FOUNDATION.md), not a single point. Shared node with semiconductor map (custom silicon).",accounting,1
Microsoft,MSFT,NASDAQ,United States,hyperscaler;model-lab,Azure cloud infrastructure and exclusive OpenAI compute/commercial partner,281.72,101.83,2917.00,32.49,64.55,FY2025 (ended 2025-06-30),https://www.sec.gov/Archives/edgar/data/789019/000095017025100235/msft-20250630.htm,2026-07-14,no,"Figures reused from 01-semiconductor, same filing, not re-derived. Carried from that row: Whole-company figures; semiconductor is a small part (custom Azure/Maia AI chips). FY2026 ended 2026-06-30 but its 10-K/earnings 8-K were not filed yet as of 2026-07-14, so FY2025 10-K (filed 2025-07-30) is the latest audited year. Market cap ~2917B as of 2026-07-14 from stockanalysis.com (secondary). Controls the primary compute/distribution channel for OpenAI, and among the largest AI capex spenders, but workloads can route to other clouds, so not a single-point chokepoint.",accounting,1
Alphabet (Google Cloud),GOOGL,NASDAQ,United States,hyperscaler;model-lab,"Google Cloud infrastructure, in-house TPUs and Gemini models",402.84,132.17,4300.00,61.09,91.45,FY2025 (ended 2025-12-31),https://www.sec.gov/Archives/edgar/data/1652044/000165204426000018/0001652044-26-000018-index.htm,2026-07-14,no,"Figures reused from 01-semiconductor (as 'Alphabet (Google)' there), same filing, not re-derived. Carried from that row: Whole-company figures; semiconductor is a small part (TPUs/custom silicon embedded in Google Cloud, not broken out). Figures from FY2025 10-K (filed 2026-02). Revenue tagged as Revenues. Market cap ~4300B as of 2026-07-13 from stockanalysis.com (secondary; range 4300-4340B). Only hyperscaler with a mature in-house AI accelerator (TPU) reducing its own Nvidia dependence, and runs a leading model lab (DeepMind/Gemini); still routable-around at the cloud layer, so it is not flagged as a chokepoint.",accounting,1
Meta Platforms,META,NASDAQ,United States,hyperscaler;model-lab,Self-operated AI datacenter fleet and Llama open-weight models,200.97,60.46,1698.00,57.37,69.69,FY2025 (ended 2025-12-31),https://www.sec.gov/Archives/edgar/data/1326801/000162828026003942/meta-20251231.htm,2026-07-14,no,"Figures reused from 01-semiconductor (as 'Meta' there), same filing, not re-derived. Carried from that row: Whole-company figures; semiconductor is a small part (custom AI silicon is a minor fraction; most capex is AI datacenter buildout). Figures from FY2025 10-K (filed 2026-01-29). Market cap ~1698B as of ~2026-07-10 from stockanalysis.com (secondary). Massive AI capex and largest open-weight model family, but does not sell cloud capacity to third parties so is not a routing chokepoint in the same sense as AWS/Azure/GCP.",accounting,1
Oracle,ORCL,NYSE,United States,hyperscaler,Oracle Cloud Infrastructure (OCI) for AI training/inference,67.36,17.09,349.63,10.27,55.66,FY2026 (ended 2026-05-31),https://www.sec.gov/Archives/edgar/data/1341439/000119312526277521/0001193125-26-277521-index.htm,2026-07-20,no,"Figures from the FY annual filing via SEC XBRL companyfacts (tools/xbrl_extract.py). Net income is attributable to parent ($17.087B); consolidated ProfitLoss is $17.309B. Capex of $55.66B is nearly all AI datacenter buildout and exceeds net income threefold. Market cap = 2880.5M shares from the filing cover page x $121.38 close on 2026-07-20 (Yahoo v8 chart endpoint, price only). Fast-growing AI cloud/back-end capacity provider (notably for OpenAI) but a distant fourth in hyperscale share.",accounting,1
CoreWeave,CRWV,NASDAQ,United States,hyperscaler;neocloud,GPU-specialist ('neocloud') cloud infrastructure,5.13,-1.17,,0.35,10.31,FY2025 (ended 2025-12-31),https://www.sec.gov/Archives/edgar/data/1769628/000176962826000104/0001769628-26-000104-index.htm,2026-07-20,no,Figures from the FY annual filing via SEC XBRL companyfacts (tools/xbrl_extract.py). Loss making: net income is negative. Capex of $10.31B against $5.13B of revenue. Market cap left EMPTY: no cover-page share count is tagged. Largest independent GPU cloud; concentrated customer base (Microsoft/OpenAI/Nvidia-linked) makes it systemically notable but replaceable at the margin.,accounting,1
Nebius Group,NBIS,NASDAQ,Netherlands,hyperscaler;neocloud,GPU-specialist cloud infrastructure (former Yandex cloud unit),0.53,0.08,,0.18,4.07,FY2025 (ended 2025-12-31),https://www.sec.gov/Archives/edgar/data/1513845/000110465926052948/0001104659-26-052948-index.htm,2026-07-20,no,Figures from the FY annual filing via SEC XBRL companyfacts (tools/xbrl_extract.py). Revenue is the continuing Nebius business; the $1.31B tagged for 2022 is the former Yandex N.V. business and was correctly rejected as stale. Market cap left EMPTY: no cover-page share count is tagged. European/emerging neocloud GPU provider; smaller scale alternative to CoreWeave.,accounting,1
OpenAI,,private,United States,model-lab,Frontier foundation models (GPT series) and ChatGPT,,,,,,,,2026-07-14,no,"Leading model lab by consumer/enterprise adoption, but Anthropic, Google and open-weight models are substitutes at the model layer; the real chokepoints sit in compute/power beneath it.",accounting,
Anthropic,,private,United States,model-lab,Frontier foundation models (Claude family),,,,,,,,2026-07-14,no,Major model lab; substitutable at the model layer relative to physical/compute chokepoints.,accounting,
